Name,Price
CAFE PELE CAFE INSTANTANEO 200 GR,  25.500
CAFE PELE CAFE INSTANTANEO 100 GR,  17.100
CAFE PELE CAFE INSTANTANEO 50 GR,  6.750
CAFE PELE CAFE INSTANTANEO 100 GR,  15.900
CAFE PELE CAFE INSTANTANEO DE 50 GR,  8.450
CAFE PELE CAFE INSTANTANEO 50 GR,  8.300
CAFE CAPPUCCINO LIGHT CAFE BELEN 72GR 6UN,  13.000
CAFE SOLUBLE SABOR AVELLANA JUAN VALDEZ 95gr,  59.500
CAFE SOLUBLE SABOR DULCE DE LECHE JUAN VALDEZ 95gr,  59.500
CAFE MATINAL SUAVE NESCAFE 160GR FCO,  25.700
BEST FILTROS DE PAPEL PARA CAFE REUTILIZABLES 103 30 UNIDAES,  6.000
BEST FILTROS DE PAPEL PARA CAFE 103 30 UNIDAES,  5.700
BEST FILTROS DE PAPEL PARA CAFE REUTILIZABLES 102 30 UNIDAES,  5.500
CAFE CAPS TOST Y MOL 12UN STARBUCKS EXPR,  44.900
BEST FILTROS DE PAPEL PARA CAFE 102 30 UNIDADES,  5.200
PORTA CAFE REF 524026 B,  65.000
CAFE TOSTADO EN GRANOS ESPRESSO INTENSO DALLMAYR 1000gr,  214.000
CAFE TOSTADO Y MOLIDO NESCAFE GOLD INTENSO 250 GR,  38.500
CAFE TOSTADO Y MOLIDO NESCAFE GOLD SUAVE 250 GR,  38.500
CAFE TOSTADO Y MOLIDO NESCAFE GOLD EQUILIBRADO 250GR,  38.500
EDULCORANTE VAINILLA 250ML HECODULC /TAZA PARA CAFE PACK,  34.000
CAFE BON AROMA GOLD 100GR FCO BON,  34.250
DARNEL CUCHARITA DESCARTABLE CAFE BLANCO 20 UNIDADES,  3.400
CARAMELO MASTICABLE SOBERANA SABOR CAFE 60GR PAQ,  2.500
CARAMELO DURO SOBERANA SABOR CAFE 60GR PAQ,  2.350
CAFE CAPPUCCINO 200GR MELITTA LAT,  15.100
SET DE POTE P/ CAFE/AZUCAR JAGUAR REF 3106,  14.900
CABRALES LA PLANTA DEL CAFE TORRADO SUAVE INSTANTANEO 50 GR,  14.800
CABRALES LA PLANTA DEL CAFE TORRADO SUAVE INSTANTANEO 100 GR,  29.500
CAFE EN CAPSULAS STARBUCKS BLON 66GR12UN,  43.900
COLADOR PARA CAFE BLISTER 1 UN TEL,  11.500
CAFE ORO NEGRO PAQUETE 100 GR MOL,  5.850
CAFE DESCAFEINADO MELITTA 250gr,  25.000
CAFE MAYO PAQUETE 500 GR MOLIDO,  32.400
CAFE ORO NEGRO PAQUETE 250 GR MOL,  14.600
CAFE ORO NEGRO PAQUETE 200 GR MOL,  11.600
CAFE MAYO PAQUETE 250 GR MOLIDO,  16.300
CAFE MAYO PAQUETE 200 GR MOLIDO,  13.000
CAFE MAYO PAQUETE 100 GR MOLIDO,  6.600
CAFE ORO NEGRO PAQUETE 500 GR MOL,  29.000
CAFE MELITTA CAJA DE 250 GR,  13.100
CAFE MELITA FCO 500 GR ,  32.750
CAFE SOLUBLE MAYO FRASCO 50 GR,  8.600
CAFE SOLUBLE MAYO FRASCO 100 GR,  16.600
CAFE SOLUBLE MAYO FRASCO 200 GR,  26.550
VASO DESECHABLE CAFE 70CC X100UN,  11.500
VASO ARGOS DESECH CAFE 100CC X100UN,  14.600
CAFE NESCAFE FRASCO 50 GR,  10.800
CAFE NESCAFE FRASCO 100 GR NUEVA PRESENTACION,  19.900
CAFE NESCAFE FRASCO 200GR INSTANT,  31.000
ESMALTE NEW COLOR PARA UÑAS CAFE Nº 507,  4.300
POTE PARA CAFE SAN REMO 2.2LT 435/3E,  11.900
RECIPIENTE JAGUAR PARA FILTRO CAFE,  14.900
CAFE SOLUBLE GRANULADO NESCAFE 50GR,  8.200
CAFE NESCAFE MATINAL X 50 GR,  7.400
CAFE SOLUBLE INSTANTANEO MELITTA,  7.250
CAFE CON LECHE MELITTA X200GR,  15.100
CAFE SOLUBLE BELEN 50 GRAMOS,  9.300
CAFE BELEN TORRADO PAQUETE 100 GRAMOS,  5.400
CAFE BELEN TORRADO PAQUETE 200 GR,  10.700
CAFE BELEN TORRADO PAQUETE 500 GRAMOS,  21.500
CAFE SOLUBLE BELEN 100 GRAMOS,  15.400
CAFE INSTANTANEO CLASICO BELEN 200gr,  27.900
CAFE SOLUBLE NORTE FRASCO 100 GR,  14.950
CAFE SOLUBLE NORTE FRASCO 200 GR,  24.500
CAFE BELEN MATINAL 100GR,  16.200
CAFE BELEN INSTANTANEO MATINAL 200GR,  25.100
CAFE SOLUBLE NORTE FRASCO 50 GR,  8.250
CAFE INSTANTANEO DESCAFEINADO BELEN 50gr,  16.500
CAFE SOLUBLE TRADICIONAL MELITTA 200gr,  26.400
CAFE DESCAFEINADO INSTANTANEO 50 GR,  16.800
CAFE MEILITA EXTRA FUERTE X500GR MELITA x 20,  32.750
FILTRO BRIGITTA PAPEL PARA CAFE N.103 CAJA 30UN,  6.900
FILTRO PARA CAFE MELITTA Nº 103,  7.500
FILTRO PARA CAFE MELITTA Nº 102,  6.500
FILTRO BRIGITTA PAPEL PARA CAFE N.102 CAJA 30UN,  6.500
FILTRO CHEFF PARA CAFE BLISTER 1 UN,  8.200
BETUN VIRGINIA LIQUIDO CAFE 60ML,  10.550
CAFE BELEN INSTANTANEO PAQUETE 8GR,  1.250
CARAMELO SOBERANA CAFE 800 GR,  14.300
CAFE NESCAFE INSTANTANEO CLASICO 8 GR,  2.100
CAFE PILAO TRADICIONAL IDEAL 250GR,  14.350
CUCHARITA TRAMONTINA COSMOS CAFE ACERO INOXIDABLE,  3.650
CAFE INSTANTANEO BELEN MATINAL POUCH 50GR,  6.600
CAFE CAPPUCCINO 140GR NESCAFE SACHET,  23.800
CAFE MOKA144GR NESCAFE CJA,  23.800
CAFE VAINILLA LATTE 148GR NESCAFE CJA,  23.800
CAFE BELEN SOLUBLE CLASICO 50GRAMOS POUCH,  7.400
CAFE SOLUBLE EXTRA FUERTE 50GR MELITTA SACHET,  7.250
CAFE MAYO MEZCLA A GRANEL,  63.900
CAFE TORRADO C/AZUCAR MOLIDO 125GR CABRALES PAQ,  13.000
CAFE IPERESPRESSO TOSTADURA 140.7GR ILLY LATA,  155.000
CAFE TORRADO MOLIDO 250GR NORCAFE PAQ,  11.900
FILTRO P/CAFE N/100 30UND MELITTA CJA,  5.400
CAFE TORRADO C/AZUCAR MOLIDO 250GR CABRALES PAQ,  24.600
